{
  "schema_version": "1.0",
  "seq": 929,
  "chapter_id": "ch0929",
  "declared_num": 927,
  "title": "盗虫，偷法",
  "label": "第927章 盗虫，偷法",
  "merged_titles": [],
  "is_merged": false,
  "source": {
    "line_start": 51950,
    "line_end": 52004,
    "char_count": 1801,
    "paragraph_count": 54
  },
  "raw_text": "既然葛道人让他们小辈忙自己的事，那便忙自己的事就好。\n准圣之争，他们掺和进去也就那样，双方都很难一时打死对方，尤其是在李一走了的情况下。\n但也正因为如此，冲突本身的范围开始不受控制的扩大，妖术与道法碰撞，大夏的皇宫摇摇欲坠。\n不过这已经不是唐真所能管的了，他有自己的任务。\n“如果阿真哥不忙，我倒是有门生意，不知你感兴趣不？”古命好看他陷入沉思，于是开口道。\n唐真回过头，只见这家伙手中握着一大把玉简，满脸都是奸商的笑容。\n忍不住与记忆中的人影缓缓重合，当年这家伙也是挂着这般的笑凑到唐真的身边。\n“我这些年虽然钻研术法少了，但每一道都是精品，绝对童叟无欺。”古命好把玉简递向唐真，“同时还附赠发现螺生之人寄宿所在的方法。”\n这对以前的唐真来说，当真是一笔稳赚不赔的买卖。\n可唐真只是轻轻摇头道：“如今的我，没有余力和精力帮你亦或者清泉宗做事。”\n他出不起价格。\n“阿真哥！你这么说可实在寒碜我了！兄弟之间，哪能算那么清楚？”古命好连连摆手，随即笑嘻嘻的竖起一根指头，神秘道。\n“回答个问题就行！就一个！”\n唐真眼神眯起，古命好是个有趣的人，一个有趣的买卖人，除了在唐真这在不知情的情况下被系统薅了好几年羊毛外，几乎从未做过亏本的生意。\n“什么问题？”唐真好奇又警惕。\n古命好微微前倾身子，靠近唐真道：“小弟想问问，那齐渊和阿真哥你之所以纠缠在一起，是不是因为一道术法？”\n“一道。。魔功！”\n天下道门术法，正途半数都出自紫云，歪门九成都来自洪辅，单说对术法的钻研与喜爱程度，九洲中洪泽辅是当之无愧的第一，不论是自研还是借鉴。\n也因此，不少匪夷所思的魔功的起源都能追溯到这片无比瑰丽的山河之中。\n据说洪泽辅有一批人专门四处收集术法，并编撰成册，起名《天下术》。\n不过唐真知道这是谣传，很多术法根本无法靠笔墨描述，自然也不会有什么《天下术》，但这帮人是真的存在的，甚至还有着一个组织的框架，而且还有个颇为土气的名字。\n‘盗虫儿’。\n这是他们自己起的，唐真不好评价。\n这帮人在清泉宗的扶持下，四处搜罗术法、功法，并进行一定程度的研究修改，如今市面上不少响彻天下的道法，都有他们的影子。\n不过，他们对洪泽辅外实在影响力薄弱，相对于强取豪夺，更倾向于重金交易。\n而在几年前，盗虫儿们找到了他们最好的合作对象，那位享誉天下的求法真君。\n交易逻辑是这样的，每当他们渴望一个道法，却无法得到时，便会找到唐真，求他去看一眼，将那道法copy过来，然后他们提供十数道不算有用，但唐真一定没见过的术法作为价码。\n表面看来，唐真完全在吃亏。\n但实际上每一笔都是十几乃至几十的点数，而且交易与否完全取决于唐真的态度。\n双方都满意的不得了。\n如今洪泽辅对于螺生的研究，必然也有着盗虫儿的参与，不过他们相对于佛宗这个引发九洲大乱的术法，似乎更看重另一个东西。\n“你怎么会这么认为？”唐真不露声色。\n“阿真哥，这两年我们也尝试过对无法进行破解，希望有朝一日能助你恢复修为，但最终所有尝试都失败了。”古命好看着唐真，眼神里闪过一丝异色。\n“但我们却研究清楚了齐渊此人，他看似洒脱，但其实算计无数，从不做无用之事，他能杀人，又何必封禁你的修为呢？”\n“我们一致认为，他必然对你有所求，而且很可能是一道和无法一同落下的道法。”\n古命好依然在笑，眼神深处那些越来越多的异色开始泛起。\n唐真沉默，这个理由很牵强，而且没什么道理，他看着古命好，觉得他的话里藏着自己需要的东西。\n“阿真哥，这买卖你做不做？”似乎被唐真看的有些发毛，古命好有些不安的问道。\n“做！为什么不做？”唐真伸手接过那一把玉简。\n。。。\n二人在院子里谈了一会，随后便分道扬镳了。\n唐真消失在皇都的视野中，不知去向，而古命好则从西门一路离开了皇都，手中把玩着那两粒写着葵和藿的石子。\n他要去接清泉宗的圣女了。\n“先选个近点的吧！”他自言自语。\n东门是皇都百姓逃亡的主要方向，人流混杂，他走在其中，带着笑意。\n此时天色已暗，早几天逃难出皇都的人已经基本离开了皇都的地界，回过头，便再也看不见那巍峨的皇城。\n疲惫与恐惧缠绕着道路上的每一个人，没人生火，没人说话，只有时有时无的咳嗽声和哭泣声。\n“歇一歇吧。”\n女子小声的开口。\n“好。”\n沙哑的声音虚弱的回答。\n在逃难人群的最边缘，一个粉裙子的女孩缓缓驻步，她牵着一匹马，马上一个男人虚弱的趴伏着。\n月色下，她抬起头，是藿。\n而马上那个虚弱的男人，则是重伤未愈的闻人哭，不过如今他换了一身平民的衣服，那张本就苍白的脸也用黑布紧紧缠绕着。",
  "paragraphs": [
    "既然葛道人让他们小辈忙自己的事，那便忙自己的事就好。",
    "准圣之争，他们掺和进去也就那样，双方都很难一时打死对方，尤其是在李一走了的情况下。",
    "但也正因为如此，冲突本身的范围开始不受控制的扩大，妖术与道法碰撞，大夏的皇宫摇摇欲坠。",
    "不过这已经不是唐真所能管的了，他有自己的任务。",
    "“如果阿真哥不忙，我倒是有门生意，不知你感兴趣不？”古命好看他陷入沉思，于是开口道。",
    "唐真回过头，只见这家伙手中握着一大把玉简，满脸都是奸商的笑容。",
    "忍不住与记忆中的人影缓缓重合，当年这家伙也是挂着这般的笑凑到唐真的身边。",
    "“我这些年虽然钻研术法少了，但每一道都是精品，绝对童叟无欺。”古命好把玉简递向唐真，“同时还附赠发现螺生之人寄宿所在的方法。”",
    "这对以前的唐真来说，当真是一笔稳赚不赔的买卖。",
    "可唐真只是轻轻摇头道：“如今的我，没有余力和精力帮你亦或者清泉宗做事。”",
    "他出不起价格。",
    "“阿真哥！你这么说可实在寒碜我了！兄弟之间，哪能算那么清楚？”古命好连连摆手，随即笑嘻嘻的竖起一根指头，神秘道。",
    "“回答个问题就行！就一个！”",
    "唐真眼神眯起，古命好是个有趣的人，一个有趣的买卖人，除了在唐真这在不知情的情况下被系统薅了好几年羊毛外，几乎从未做过亏本的生意。",
    "“什么问题？”唐真好奇又警惕。",
    "古命好微微前倾身子，靠近唐真道：“小弟想问问，那齐渊和阿真哥你之所以纠缠在一起，是不是因为一道术法？”",
    "“一道。。魔功！”",
    "天下道门术法，正途半数都出自紫云，歪门九成都来自洪辅，单说对术法的钻研与喜爱程度，九洲中洪泽辅是当之无愧的第一，不论是自研还是借鉴。",
    "也因此，不少匪夷所思的魔功的起源都能追溯到这片无比瑰丽的山河之中。",
    "据说洪泽辅有一批人专门四处收集术法，并编撰成册，起名《天下术》。",
    "不过唐真知道这是谣传，很多术法根本无法靠笔墨描述，自然也不会有什么《天下术》，但这帮人是真的存在的，甚至还有着一个组织的框架，而且还有个颇为土气的名字。",
    "‘盗虫儿’。",
    "这是他们自己起的，唐真不好评价。",
    "这帮人在清泉宗的扶持下，四处搜罗术法、功法，并进行一定程度的研究修改，如今市面上不少响彻天下的道法，都有他们的影子。",
    "不过，他们对洪泽辅外实在影响力薄弱，相对于强取豪夺，更倾向于重金交易。",
    "而在几年前，盗虫儿们找到了他们最好的合作对象，那位享誉天下的求法真君。",
    "交易逻辑是这样的，每当他们渴望一个道法，却无法得到时，便会找到唐真，求他去看一眼，将那道法copy过来，然后他们提供十数道不算有用，但唐真一定没见过的术法作为价码。",
    "表面看来，唐真完全在吃亏。",
    "但实际上每一笔都是十几乃至几十的点数，而且交易与否完全取决于唐真的态度。",
    "双方都满意的不得了。",
    "如今洪泽辅对于螺生的研究，必然也有着盗虫儿的参与，不过他们相对于佛宗这个引发九洲大乱的术法，似乎更看重另一个东西。",
    "“你怎么会这么认为？”唐真不露声色。",
    "“阿真哥，这两年我们也尝试过对无法进行破解，希望有朝一日能助你恢复修为，但最终所有尝试都失败了。”古命好看着唐真，眼神里闪过一丝异色。",
    "“但我们却研究清楚了齐渊此人，他看似洒脱，但其实算计无数，从不做无用之事，他能杀人，又何必封禁你的修为呢？”",
    "“我们一致认为，他必然对你有所求，而且很可能是一道和无法一同落下的道法。”",
    "古命好依然在笑，眼神深处那些越来越多的异色开始泛起。",
    "唐真沉默，这个理由很牵强，而且没什么道理，他看着古命好，觉得他的话里藏着自己需要的东西。",
    "“阿真哥，这买卖你做不做？”似乎被唐真看的有些发毛，古命好有些不安的问道。",
    "“做！为什么不做？”唐真伸手接过那一把玉简。",
    "。。。",
    "二人在院子里谈了一会，随后便分道扬镳了。",
    "唐真消失在皇都的视野中，不知去向，而古命好则从西门一路离开了皇都，手中把玩着那两粒写着葵和藿的石子。",
    "他要去接清泉宗的圣女了。",
    "“先选个近点的吧！”他自言自语。",
    "东门是皇都百姓逃亡的主要方向，人流混杂，他走在其中，带着笑意。",
    "此时天色已暗，早几天逃难出皇都的人已经基本离开了皇都的地界，回过头，便再也看不见那巍峨的皇城。",
    "疲惫与恐惧缠绕着道路上的每一个人，没人生火，没人说话，只有时有时无的咳嗽声和哭泣声。",
    "“歇一歇吧。”",
    "女子小声的开口。",
    "“好。”",
    "沙哑的声音虚弱的回答。",
    "在逃难人群的最边缘，一个粉裙子的女孩缓缓驻步，她牵着一匹马，马上一个男人虚弱的趴伏着。",
    "月色下，她抬起头，是藿。",
    "而马上那个虚弱的男人，则是重伤未愈的闻人哭，不过如今他换了一身平民的衣服，那张本就苍白的脸也用黑布紧紧缠绕着。"
  ],
  "analysis": {
    "one_line": "唐真拒绝古命好交易，古命好独自离开皇都接圣女。",
    "synopsis": "唐真因准圣之争波及皇宫，决定不掺和，转而处理自己的任务。古命好趁机向唐真推销玉简，并提出只需回答一个问题作为交换，问题涉及齐渊与唐真纠缠是否因一道魔功。唐真虽觉理由牵强，但最终接受交易。随后两人分道扬镳，唐真消失，古命好从西门离开皇都，前往接清泉宗圣女。途中，他遇到逃难人群中的藿和重伤的闻人哭。",
    "time_setting": "天色已暗",
    "emotional_tone": "平静中带神秘",
    "characters": [
      {
        "name": "唐真",
        "aliases": [
          "阿真哥"
        ],
        "role_in_chapter": "主导",
        "mentioned_only": false,
        "appearance_quotes": [],
        "state": "修为被封，无余力帮人",
        "actions": [
          "拒绝古命好的交易，后接受",
          "接过玉简",
          "消失在皇都视野中"
        ]
      },
      {
        "name": "古命好",
        "aliases": [],
        "role_in_chapter": "主导",
        "mentioned_only": false,
        "appearance_quotes": [
          "手中握着一大把玉简，满脸都是奸商的笑容"
        ],
        "state": "奸商笑容，眼神异色",
        "actions": [
          "向唐真推销玉简",
          "提出交易条件",
          "从西门离开皇都",
          "前往接清泉宗圣女"
        ]
      },
      {
        "name": "藿",
        "aliases": [],
        "role_in_chapter": "参与",
        "mentioned_only": false,
        "appearance_quotes": [
          "粉裙子的女孩"
        ],
        "state": "牵马，在逃难人群边缘",
        "actions": [
          "驻步，牵马"
        ]
      },
      {
        "name": "闻人哭",
        "aliases": [],
        "role_in_chapter": "参与",
        "mentioned_only": false,
        "appearance_quotes": [
          "换了一身平民的衣服，那张本就苍白的脸也用黑布紧紧缠绕着"
        ],
        "state": "重伤未愈",
        "actions": [
          "虚弱的趴伏在马上"
        ]
      },
      {
        "name": "齐渊",
        "aliases": [],
        "role_in_chapter": "提及",
        "mentioned_only": true,
        "appearance_quotes": [],
        "state": "",
        "actions": []
      },
      {
        "name": "葛道人",
        "aliases": [],
        "role_in_chapter": "提及",
        "mentioned_only": true,
        "appearance_quotes": [],
        "state": "",
        "actions": []
      },
      {
        "name": "李一",
        "aliases": [],
        "role_in_chapter": "提及",
        "mentioned_only": true,
        "appearance_quotes": [],
        "state": "",
        "actions": []
      }
    ],
    "scenes": [
      {
        "name": "皇都（院子）",
        "type": "室外",
        "time_of_day": "未明确",
        "description_quotes": [],
        "present_characters": [
          "唐真",
          "古命好"
        ],
        "events": [
          "古命好向唐真推销玉简",
          "唐真拒绝后接受",
          "两人分道扬镳"
        ],
        "para_range": [
          1,
          41
        ]
      },
      {
        "name": "皇都西门",
        "type": "室外",
        "time_of_day": "天色已暗",
        "description_quotes": [
          "此时天色已暗，早几天逃难出皇都的人已经基本离开了皇都的地界，回过头，便再也看不见那巍峨的皇城。",
          "疲惫与恐惧缠绕着道路上的每一个人，没人生火，没人说话，只有时有时无的咳嗽声和哭泣声。"
        ],
        "present_characters": [
          "古命好",
          "藿",
          "闻人哭"
        ],
        "events": [
          "古命好从西门离开",
          "遇到逃难人群中的藿和闻人哭"
        ],
        "para_range": [
          42,
          53
        ]
      }
    ],
    "dialogues": [
      {
        "para": 5,
        "speaker": "古命好",
        "addressee": "唐真",
        "text": "如果阿真哥不忙，我倒是有门生意，不知你感兴趣不？",
        "manner": "开口道"
      },
      {
        "para": 8,
        "speaker": "古命好",
        "addressee": "唐真",
        "text": "我这些年虽然钻研术法少了，但每一道都是精品，绝对童叟无欺。",
        "manner": "把玉简递向唐真"
      },
      {
        "para": 8,
        "speaker": "古命好",
        "addressee": "唐真",
        "text": "同时还附赠发现螺生之人寄宿所在的方法。",
        "manner": ""
      },
      {
        "para": 10,
        "speaker": "唐真",
        "addressee": "古命好",
        "text": "如今的我，没有余力和精力帮你亦或者清泉宗做事。",
        "manner": "轻轻摇头道"
      },
      {
        "para": 12,
        "speaker": "古命好",
        "addressee": "唐真",
        "text": "阿真哥！你这么说可实在寒碜我了！兄弟之间，哪能算那么清楚？",
        "manner": "连连摆手，笑嘻嘻的竖起一根指头"
      },
      {
        "para": 13,
        "speaker": "古命好",
        "addressee": "唐真",
        "text": "回答个问题就行！就一个！",
        "manner": "神秘道"
      },
      {
        "para": 15,
        "speaker": "唐真",
        "addressee": "古命好",
        "text": "什么问题？",
        "manner": "好奇又警惕"
      },
      {
        "para": 16,
        "speaker": "古命好",
        "addressee": "唐真",
        "text": "小弟想问问，那齐渊和阿真哥你之所以纠缠在一起，是不是因为一道术法？",
        "manner": "微微前倾身子，靠近唐真道"
      },
      {
        "para": 17,
        "speaker": "古命好",
        "addressee": "唐真",
        "text": "一道。。魔功！",
        "manner": ""
      },
      {
        "para": 32,
        "speaker": "唐真",
        "addressee": "古命好",
        "text": "你怎么会这么认为？",
        "manner": "不露声色"
      },
      {
        "para": 33,
        "speaker": "古命好",
        "addressee": "唐真",
        "text": "阿真哥，这两年我们也尝试过对无法进行破解，希望有朝一日能助你恢复修为，但最终所有尝试都失败了。",
        "manner": "看着唐真，眼神里闪过一丝异色"
      },
      {
        "para": 34,
        "speaker": "古命好",
        "addressee": "唐真",
        "text": "但我们却研究清楚了齐渊此人，他看似洒脱，但其实算计无数，从不做无用之事，他能杀人，又何必封禁你的修为呢？",
        "manner": ""
      },
      {
        "para": 35,
        "speaker": "古命好",
        "addressee": "唐真",
        "text": "我们一致认为，他必然对你有所求，而且很可能是一道和无法一同落下的道法。",
        "manner": ""
      },
      {
        "para": 38,
        "speaker": "古命好",
        "addressee": "唐真",
        "text": "阿真哥，这买卖你做不做？",
        "manner": "有些不安的问道"
      },
      {
        "para": 39,
        "speaker": "唐真",
        "addressee": "古命好",
        "text": "做！为什么不做？",
        "manner": "伸手接过那一把玉简"
      },
      {
        "para": 44,
        "speaker": "古命好",
        "addressee": "自己",